ID,What you see/hear
1,A shooting star streaking across the night sky.
2,Glowing fireflies dancing among the trees.
3,"The moonlight filtering through the leaves, creating dappled patterns on the forest floor."
4,The distant hoot of an owl echoing through the woods.
5,"A pair of curious eyes gleaming in the darkness, belonging to a nocturnal forest creature."
6,"A gentle mist settling in, giving the forest an ethereal quality."
7,The faint rustle of leaves as a small breeze passes through the trees.
8,"A distant, haunting howl of a wolf, echoing through the night."
9,"The soft shimmering of a spider's web, catching the moonlight."
10,The distant call of a loon from a nearby lake.
11,"The rhythmic chirping of crickets, creating a soothing nighttime melody."
12,"A solitary bat swooping through the air, hunting for insects."
13,The faint glow of bioluminescent fungi illuminating the forest floor.
14,A cluster of mushrooms releasing a puff of spores into the air.
15,The gentle glisten of dew on leaves and grass.
16,"The distant, echoing call of a barred owl."
17,"The silhouette of a large, majestic owl perched on a high branch."
18,The occasional twinkle of starlight through breaks in the canopy.
19,The soft hooting of a distant great horned owl.
20,The rhythmic croak of a nearby frog.
21,The distant call of a whip-poor-will.
22,A family of raccoons playfully foraging through the underbrush.
23,The distant chattering of squirrels.
24,A patch of glowing fungi creating a natural nightlight.
25,The swaying of tall grasses in the breeze.
26,"The distant call of a fox, echoing through the forest."
27,"A skunk waddling through the campsite, searching for scraps."
28,The glint of moonlight on a nearby stream or pond.
29,The soft buzz of nocturnal insects in the underbrush.
30,The distant call of a screech owl.
31,The rustling of leaves as a small woodland creature scurries by.
32,A patch of luminescent moss on the forest floor.
33,The soft patter of rain on leaves during a light drizzle.
34,The shimmering reflection of the moon on a still pond.
35,The distant howling of a coyote pack.
36,The rustling of leaves as a deer moves through the underbrush.
37,A family of fireflies forming a twinkling constellation in the night air.
38,The occasional glint of animal eyes in the darkness.
39,The distant call of a whippoorwill.
40,The gentle hum of insects in the night air.
41,The distant cawing of a raven.
42,The faint sound of a distant waterfall.
43,The soft glow of a campfire in the distance.
44,The shimmering reflection of stars on the surface of a pond.
45,The distant call of a barred owl.
46,"A shadowy figure moving through the underbrush, likely another traveler or animal."
47,The soft hooting of an owl nearby.
48,The gentle fluttering of moths around a lantern.
49,"The distant chirping of crickets, creating a comforting nighttime chorus."
50,The occasional rustling of small mammals in the leaves.
51,The distant call of a loon on a nearby lake.
52,The flicker of firelight through the trees from a distant campsite.
53,The soft call of a distant whip-poor-will.
54,"A small stream gurgling nearby, its presence announced by the occasional splash."
55,The rhythmic croak of a frog in a nearby pond.
56,The distant howling of a lone wolf.
57,The soft footsteps of a nocturnal forest creature passing through.
58,The gentle sway of branches in the night breeze.
59,"The distant call of a fox, its voice carrying through the trees."
60,The faint glow of the Milky Way stretching across the night sky.
61,The distant chittering of a bat on the wing.
62,The occasional rustle of leaves as a breeze passes through.
63,The soft glow of a firefly landing on a nearby leaf.
64,The distant call of a screech owl in the night.
65,The gentle buzz of nocturnal insects in the underbrush.
66,The shimmering reflection of moonlight on a calm pond.
67,"The distant howling of a coyote, a lonely sound in the night."
68,The rustling of leaves as a small creature searches for food.
69,A patch of bioluminescent fungi casting an otherworldly glow.
70,The soft patter of rain on leaves during a light drizzle.
71,The distant call of a whippoorwill in the night air.
72,The occasional glint of animal eyes in the darkness.
73,"The distant cawing of a raven, carrying on the night wind."
74,The gentle hum of insects in the night air.
75,The soft glow of a lantern in the distance.
76,The shimmering reflection of stars on a pond's surface.
77,"The distant hooting of an owl, echoing through the night."
78,"The soft chirping of crickets, creating a soothing nighttime symphony."
79,The occasional rustling of leaves as creatures move about.
80,"The distant call of a loon, carrying over from a nearby lake."
81,The flickering of firelight through the trees from a distant campsite.
82,The soft call of a distant whip-poor-will.
83,"A small stream babbling nearby, its sound carrying through the night air."
84,The rhythmic croak of a frog in a nearby pond.
85,"The distant howling of a lone wolf, haunting and beautiful."
86,The soft footsteps of a nocturnal creature passing through.
87,The gentle sway of branches in the night breeze.
88,"The distant call of a fox, its voice carrying through the trees."
89,The faint glow of the Milky Way stretching across the night sky.
90,The distant chittering of a bat on the wing.
91,The occasional rustle of leaves as a breeze passes through.
92,The soft glow of a firefly landing on a nearby leaf.
93,The distant call of a screech owl in the night.
94,The gentle buzz of nocturnal insects in the underbrush.
95,The shimmering reflection of moonlight on a calm pond.
96,"The distant howling of a coyote, a lonely sound in the night."
97,The rustling of leaves as a small creature searches for food.
98,A patch of bioluminescent fungi casting an otherworldly glow.
99,The soft patter of rain on leaves during a light drizzle.
100,The distant call of a whippoorwill in the night air.
